{
  "$schema": "../schema/randament-padure.schema.json",
  "id": "randament-padure-2025",
  "title": "Randamentul terenului forestier, din recolta de lemn și prețul pe picior",
  "publisher": "romania-reforms",
  "counties": [
    "AB",
    "BC",
    "BH",
    "BN",
    "BT",
    "BZ",
    "CJ",
    "DB",
    "GR",
    "HD",
    "HR",
    "IF",
    "IS",
    "MM",
    "MS",
    "NT",
    "PH",
    "SB",
    "SJ",
    "SM",
    "SV",
    "VN",
    "VS"
  ],
  "period": "2025",
  "currency": "RON",
  "provenance": {
    "source": "ins-tempo-agr306a-romsilva-grile-notariale",
    "locator": "recolta pe hectar (INS AGR306A, prin lemn-recoltat) × prețul masei lemnoase pe picior (Romsilva) × (1 − cota de costuri), împărțit la valoarea pădurii pe hectar din grilele notariale",
    "confidence": "derived",
    "note": "Nu există o arendă a pădurii de măsurat. Cele două intrări măsurate sunt recolta și prețul; cota de costuri a proprietarului este un parametru declarat."
  },
  "assumptions": {
    "stumpageLeiPerM3": {
      "low": 187.89,
      "central": 230.4,
      "high": 230.4
    },
    "stumpageSource": "RNP-Romsilva, licitații și negocieri de masă lemnoasă pe picior, primele nouă luni ale anului 2025: preț mediu de adjudecare 230,40 lei/m³, preț mediu de pornire 187,89 lei/m³",
    "ownerCostShare": {
      "low": 0.35,
      "central": 0.25,
      "high": 0.15
    },
    "ronPerEur": 5.2567
  },
  "summary": {
    "counties": 23,
    "yieldPercent": {
      "low": 1.3459,
      "central": 1.9043,
      "high": 2.1582
    },
    "nationalM3PerHaPerYear": 2.8824,
    "arableYieldPercentForComparison": 1.43
  },
  "counties_measured": [
    {
      "county": "AB",
      "m3PerHaPerYear": 2.1949,
      "forestHa": 57315.0,
      "forestShareOfCountyPriced": 0.2528,
      "forestValueRonPerHa": 42886.77,
      "rentRonPerHaPerYear": {
        "low": 268.06,
        "central": 379.28,
        "high": 429.85
      },
      "yieldPercent": {
        "low": 0.625,
        "central": 0.8844,
        "high": 1.0023
      }
    },
    {
      "county": "BC",
      "m3PerHaPerYear": 3.7363,
      "forestHa": 280918.0,
      "forestShareOfCountyPriced": 1.0,
      "forestValueRonPerHa": 28911.85,
      "rentRonPerHaPerYear": {
        "low": 456.31,
        "central": 645.63,
        "high": 731.72
      },
      "yieldPercent": {
        "low": 1.5783,
        "central": 2.2331,
        "high": 2.5309
      }
    },
    {
      "county": "BH",
      "m3PerHaPerYear": 2.5376,
      "forestHa": 178532.0,
      "forestShareOfCountyPriced": 0.9746,
      "forestValueRonPerHa": 27759.84,
      "rentRonPerHaPerYear": {
        "low": 309.91,
        "central": 438.5,
        "high": 496.96
      },
      "yieldPercent": {
        "low": 1.1164,
        "central": 1.5796,
        "high": 1.7902
      }
    },
    {
      "county": "BN",
      "m3PerHaPerYear": 2.864,
      "forestHa": 194096.0,
      "forestShareOfCountyPriced": 1.0,
      "forestValueRonPerHa": 30043.17,
      "rentRonPerHaPerYear": {
        "low": 349.78,
        "central": 494.9,
        "high": 560.89
      },
      "yieldPercent": {
        "low": 1.1642,
        "central": 1.6473,
        "high": 1.8669
      }
    },
    {
      "county": "BT",
      "m3PerHaPerYear": 2.5287,
      "forestHa": 56023.0,
      "forestShareOfCountyPriced": 1.0,
      "forestValueRonPerHa": 20975.94,
      "rentRonPerHaPerYear": {
        "low": 308.83,
        "central": 436.96,
        "high": 495.22
      },
      "yieldPercent": {
        "low": 1.4723,
        "central": 2.0831,
        "high": 2.3609
      }
    },
    {
      "county": "BZ",
      "m3PerHaPerYear": 2.8483,
      "forestHa": 154446.0,
      "forestShareOfCountyPriced": 1.0,
      "forestValueRonPerHa": 22078.14,
      "rentRonPerHaPerYear": {
        "low": 347.86,
        "central": 492.19,
        "high": 557.81
      },
      "yieldPercent": {
        "low": 1.5756,
        "central": 2.2293,
        "high": 2.5265
      }
    },
    {
      "county": "CJ",
      "m3PerHaPerYear": 1.8826,
      "forestHa": 156649.0,
      "forestShareOfCountyPriced": 1.0,
      "forestValueRonPerHa": 46183.85,
      "rentRonPerHaPerYear": {
        "low": 229.92,
        "central": 325.31,
        "high": 368.69
      },
      "yieldPercent": {
        "low": 0.4978,
        "central": 0.7044,
        "high": 0.7983
      }
    },
    {
      "county": "DB",
      "m3PerHaPerYear": 3.0657,
      "forestHa": 116755.0,
      "forestShareOfCountyPriced": 1.0,
      "forestValueRonPerHa": 18685.82,
      "rentRonPerHaPerYear": {
        "low": 374.41,
        "central": 529.75,
        "high": 600.39
      },
      "yieldPercent": {
        "low": 2.0037,
        "central": 2.8351,
        "high": 3.2131
      }
    },
    {
      "county": "GR",
      "m3PerHaPerYear": 2.9834,
      "forestHa": 37943.0,
      "forestShareOfCountyPriced": 1.0,
      "forestValueRonPerHa": 27072.01,
      "rentRonPerHaPerYear": {
        "low": 364.36,
        "central": 515.53,
        "high": 584.27
      },
      "yieldPercent": {
        "low": 1.3459,
        "central": 1.9043,
        "high": 2.1582
      }
    },
    {
      "county": "HD",
      "m3PerHaPerYear": 2.197,
      "forestHa": 357081.0,
      "forestShareOfCountyPriced": 1.0,
      "forestValueRonPerHa": 15223.79,
      "rentRonPerHaPerYear": {
        "low": 268.32,
        "central": 379.64,
        "high": 430.26
      },
      "yieldPercent": {
        "low": 1.7625,
        "central": 2.4937,
        "high": 2.8262
      }
    },
    {
      "county": "HR",
      "m3PerHaPerYear": 6.2107,
      "forestHa": 233315.0,
      "forestShareOfCountyPriced": 1.0,
      "forestValueRonPerHa": 32148.87,
      "rentRonPerHaPerYear": {
        "low": 758.5,
        "central": 1073.21,
        "high": 1216.3
      },
      "yieldPercent": {
        "low": 2.3593,
        "central": 3.3382,
        "high": 3.7833
      }
    },
    {
      "county": "IF",
      "m3PerHaPerYear": 1.7766,
      "forestHa": 25217.0,
      "forestShareOfCountyPriced": 1.0,
      "forestValueRonPerHa": 25232.16,
      "rentRonPerHaPerYear": {
        "low": 216.97,
        "central": 307.0,
        "high": 347.93
      },
      "yieldPercent": {
        "low": 0.8599,
        "central": 1.2167,
        "high": 1.3789
      }
    },
    {
      "county": "IS",
      "m3PerHaPerYear": 3.0984,
      "forestHa": 89027.0,
      "forestShareOfCountyPriced": 0.9822,
      "forestValueRonPerHa": 63715.42,
      "rentRonPerHaPerYear": {
        "low": 378.4,
        "central": 535.4,
        "high": 606.79
      },
      "yieldPercent": {
        "low": 0.5939,
        "central": 0.8403,
        "high": 0.9523
      }
    },
    {
      "county": "MM",
      "m3PerHaPerYear": 1.8815,
      "forestHa": 276846.0,
      "forestShareOfCountyPriced": 0.9734,
      "forestValueRonPerHa": 22982.79,
      "rentRonPerHaPerYear": {
        "low": 229.78,
        "central": 325.12,
        "high": 368.47
      },
      "yieldPercent": {
        "low": 0.9998,
        "central": 1.4146,
        "high": 1.6033
      }
    },
    {
      "county": "MS",
      "m3PerHaPerYear": 3.1783,
      "forestHa": 209451.0,
      "forestShareOfCountyPriced": 1.0,
      "forestValueRonPerHa": 27257.71,
      "rentRonPerHaPerYear": {
        "low": 388.16,
        "central": 549.21,
        "high": 622.44
      },
      "yieldPercent": {
        "low": 1.424,
        "central": 2.0149,
        "high": 2.2835
      }
    },
    {
      "county": "NT",
      "m3PerHaPerYear": 5.8904,
      "forestHa": 260950.0,
      "forestShareOfCountyPriced": 1.0,
      "forestValueRonPerHa": 28911.85,
      "rentRonPerHaPerYear": {
        "low": 719.39,
        "central": 1017.86,
        "high": 1153.58
      },
      "yieldPercent": {
        "low": 2.4882,
        "central": 3.5206,
        "high": 3.99
      }
    },
    {
      "county": "PH",
      "m3PerHaPerYear": 2.9184,
      "forestHa": 146046.0,
      "forestShareOfCountyPriced": 1.0,
      "forestValueRonPerHa": 18685.82,
      "rentRonPerHaPerYear": {
        "low": 356.42,
        "central": 504.3,
        "high": 571.54
      },
      "yieldPercent": {
        "low": 1.9074,
        "central": 2.6988,
        "high": 3.0587
      }
    },
    {
      "county": "SB",
      "m3PerHaPerYear": 2.4623,
      "forestHa": 149199.0,
      "forestShareOfCountyPriced": 0.756,
      "forestValueRonPerHa": 44921.34,
      "rentRonPerHaPerYear": {
        "low": 300.72,
        "central": 425.49,
        "high": 482.22
      },
      "yieldPercent": {
        "low": 0.6694,
        "central": 0.9472,
        "high": 1.0735
      }
    },
    {
      "county": "SJ",
      "m3PerHaPerYear": 2.0106,
      "forestHa": 105542.0,
      "forestShareOfCountyPriced": 1.0,
      "forestValueRonPerHa": 18259.39,
      "rentRonPerHaPerYear": {
        "low": 245.55,
        "central": 347.43,
        "high": 393.76
      },
      "yieldPercent": {
        "low": 1.3448,
        "central": 1.9028,
        "high": 2.1565
      }
    },
    {
      "county": "SM",
      "m3PerHaPerYear": 2.3923,
      "forestHa": 52388.0,
      "forestShareOfCountyPriced": 0.7329,
      "forestValueRonPerHa": 40479.38,
      "rentRonPerHaPerYear": {
        "low": 292.17,
        "central": 413.39,
        "high": 468.51
      },
      "yieldPercent": {
        "low": 0.7218,
        "central": 1.0212,
        "high": 1.1574
      }
    },
    {
      "county": "SV",
      "m3PerHaPerYear": 4.9215,
      "forestHa": 388737.0,
      "forestShareOfCountyPriced": 1.0,
      "forestValueRonPerHa": 20520.85,
      "rentRonPerHaPerYear": {
        "low": 601.06,
        "central": 850.44,
        "high": 963.83
      },
      "yieldPercent": {
        "low": 2.929,
        "central": 4.1442,
        "high": 4.6968
      }
    },
    {
      "county": "VN",
      "m3PerHaPerYear": 3.1237,
      "forestHa": 170094.0,